{
  "__type__": "Program",
  "blocks": {},
  "config": {
    "token": "0:dummy",
    "version": "1.0"
  },
  "globals": {},
  "handlers": [
    {
      "__type__": "Handler",
      "body": [
        {
          "__type__": "If",
          "condition": {
            "__type__": "BinaryOp",
            "left": {
              "__type__": "Variable",
              "name": "текст"
            },
            "op": "==",
            "right": {
              "__type__": "Literal",
              "value": "да"
            }
          },
          "else_body": [],
          "then_body": [
            {
              "__type__": "Reply",
              "parts": [
                "ok"
              ]
            }
          ]
        }
      ],
      "kind": "command",
      "trigger": "/t"
    }
  ],
  "scenarios": {},
  "schemaVersion": 1
}
